Cik krāsu ir varavīksnē?;Septiņas;easy
Kurš bija pirmais Latvijas republikas prezidents?;Jānis Čakste;easy
Kurā pilsētā atrodas Eifeļa tornis?;Parīzē;easy
Kurš uzgleznoja Monu Lizu?; Leonardo da Vinči;easy
Kā sauc cūciņas Peppas brāli?; Džordžs;easy
Kurš ir Toms no multiplikācijas filmas Toms un Džerijs? Kaķis vai pele?;Kaķis;easy
Ko mēra ar termometru?;temperatūru;easy
Kurš dzīvo Dzīvžogu ielā 4?; Harijs Poters;easy
Cik riteņu ir kvadraciklam?; Četri;easy
Kā sauc kaķi no multiplikācijas filmu cikla "Fantadroms"?; Indriķis Trīspadsmitais;hard
Kura ir lielākā planēta Saules sistēmā?;Jupiters;easy
Cik zobu ir pieaugušam cilvēkam?;Trīsdesmit divi;easy
Kura ir mazākā valsts pasaulē?;Vatikāns;medium
Nosauciet trīs pamatkrāsas?;Zils, sarkans, dzeltens;medium
Kurā datumā ir Līgai vārdadiena?; 23. jūnijā; medium
Kādā krāsā ir Latvijas karogs?; Sarkanbaltsarkans; easy
Cik centimetru ir vienā metrā?; Simts; easy
Kurš ir lielākais putns pasaulē?; Strauss; easy
Kas attēlots Baložu ģerbonī?; Varde; hard
Kas attēlots Sabiles ģerbonī?; Vīnogu ķekars;hard
Kādā krāsā ir rubīns?; Sarkanā; easy
Cik kāju ir zirneklim?; Astoņas; easy
Kā sauc seriālu bērniem, kurā galvenā varone ir meitene ar rotaļu biedriem Lapsu, Feneku un Āpsīti?; Tutas lietas; medium
Citam kož - pats raud! Kas tas ir?; Zāģis; medium
Cik nuļļu ir vienam miljonam?; Sešas; easy
Kādā auglī iekārtota Sūkļa Boba Kvadrātbikša māja?; Ananāsā; easy
Kāds dzīvnieks ir Vinnijs Pūks?; lācis; easy
Ko Sivēns uzdāvināja ēzelītim I-Ā dzimšanas dienā?; Saplēstu balonu; medium
Kā sauc Annas māsu no animācijas filmas Ledus sirds (Frozen)?; Elza; easy
Cik šķautņu ir kubam?; Divpadsmit; medium
Cik metru ir kilometrā?; Tūkstotis; easy
Kura planēta ir vistuvākā Saulei?; Merkurs; medium
Kā sauc aitu mazuļus?; Jēri; easy
Kā sauc govju mazuļus?; Teļi; easy
Kā sauc suņu mazuļus?; Kucēni; easy
Nosauc mazāko kontinentu!; Austrālija; medium
Kādā krāsā ir smaragds?; Zaļā; easy
No kādiem augļiem gatavo rozīnes?; No vīnogām; medium
Kādas sugas zivs ir Nemo no animācijas filmas Meklējot Nemo?; Klaunzivs; medium
Kurā valstī atrodas Lielā Gizas piramīda?; Ēģiptē; medium
Cik dienu ir gadā?; 365; easy
Kā sauc rotaļu kovboju no animācijas filmas Rotaļlietas stāsts?; Vudijs; easy
Kuram dzīvniekam ir garākais kakls?; Žirafei; easy
Kurš ir augstākais kalns uz Zemes?; Everests; easy
Kurā debesspusē aust Saule?; Austrumos; easy
Kā sauc Harija Potera pūci?; Hedviga; easy
Kurš ir Grieķijas dievu valdnieks?; Zevs; hard
Kas ir polka?; Deja; hard
Kas ir dziļākā vieta uz Zemes?; Mariannas dziļvaga (aptuveni 11km dziļa); hard
Kurš ir pats mazākais zīdītājs pasaulē?; Etrūrijas cirslītis (Suncus etruscus) sver mazāk kā 2 gramus; hard
Kurus dzīvniekus mēdz saukt par "jūras govīm"?; Lamantīnus; hard
Kura valsts uzdāvināja ASV Brīvības statuju?; Francija; hard
Kurš ir lielākais kaķu dzimtas dzīvnieks?; Tīģeris; easy
Kurs ir mazākais putns pasaulē?; Bišu kolibri (Mellisuga helenae); hard
Kuri zīdītāji dēj olas?; Ehidnas un pīļknābji; hard
Kuri dzīvnieki spēj iemācīties atdarināt cilvēku valodu?; Papagaiļi; easy
Kurš zīdītājs prot lidot?; Sikspārnis; easy
Kurš sauszemes dzīvnieks spēj visplatāk atvērt muti?; Nīlzirgs; hard
Kura ir garākā upe pasaulē?; Nīla. Tā atrodas Āfrikā un ir 6852 km gara.; hard; Nosaukums "Nīla" cēlies no grieķu valodas vārda Neilos (Νειλος) — ‘upes ieleja’.
Kā sauc zivju elpošanas orgānu?; Žaunas; hard
Kā sauc bišu tēviņu?; Trans; hard; Atšķirībā no pārējām bitēm traniem nav dzeloņa.
Kuram dinozauram bija 15 ragu?; Kosmoceratopam; hard
No kā baidās cilvēki, kuri cieš no arahnofobijas?; No zirnekļiem; hard
Kuri odi kož? Mātītes vai tēviņi?; Mātītes jo asinis nepieciešamas lai dētu oliņas; easy
Kurš dzīvnieks ēd tikai eikaliptu lapas?; Koala; medium
Kuram putnam ir vislielākais spārnu plētums?; Klejotājalbatrosa (Diomedea exulans) spārnu plētums var sasniegt 3.5 metrus; hard
Kuram dzīvniekam ir spēcīgākais sakodiens?; Nīlas krokodilam; hard
Kurš dzīvnieks rada kakas kubiņu formā?; Vombats; hard
Kādā krāsā ir polārlāču kažoka matiņi?; Caurspīgīgi. Tie atstaro gaismu tāpēc izskatās balti; hard
Kas ir Latvijas galvaspilsēta?; Rīga; easy
Kas ir Lietuvas galvaspilsēta?; Viļņa; medium
Kas ir Igaunijas galvaspilsēta?; Tallina; medium
Kurā valstī sākās Olimpisko spēļu tradīcija?; Grieķijā; hard
Cik apļu ir Olimpisko spēļu logo?; Pieci; medium
Kurš izgudroja telefonu?; Aleksandrs Bells; hard
Kurā gadā sākās Otrais pasaules karš?; 1939; medium
No cik turnīriem sastāv Grand Slam tenisā?; No četriem: Austrālijas, Francijas, Vimbldonas un ASV; hard
Cik bieži notiek pasaules kauss futbolā?; Reizi četros gados; hard
Kā sauc brīdi, kurā diena un nakts ir vienāda garuma?; Ekvinokcija notiek divas reizes gadā - rudenī un pavasarī; hard
Vai tomāts ir dārzenis vai oga?; Oga; medium
Kura ir pasaulē lielākā sala, kas nav kontinents?; Grenlande; hard
Kura ir karstākā planēta Saules sistēmā?; Venēra; hard
Kuru planētu reizēm sauc par "Sarkano planētu"?; Marsu; hard
Cik mēnešu ir Marsam?; Divi - Foboss un Deimoss; hard
Kā sauc vietu, kurā lieto teleskopus un citas iekārtas kosmosa pētīšanai?; Observatorija; hard
Cik veca ir Saule?; Aptuveni 4.6 miljardi gadu; hard
Kā sauc pirmo cilvēku, kurš izkāpa uz Mēness?; Nīls Ārmstrongs; hard
Cik ilgs laiks nepieciešams lai gaisma atlidotu no Saules līdz Zemei?; Aptuveni 8.3 minūtes, jeb 499 sekundes; hard
Kurš bija pirmais cilvēks kosmosā?; Jurijs Gagarins; hard
Kā sauc grieķu Kara un gudrības dievieti?; Atēna; hard
Kurš ir Nobela prēmijas dibinātājs?; Alfrēds Nobels; hard
Kurā valstī izgudroja papīra naudu?; Ķīnā; hard
Kurš ir slavenās lugas "Hamlets" autors?; Viljams Šekspīrs; medium
Cik gleznu Vincents van Gogs pārdeva savas dzīves laikā?; Tikai vienu; hard
Kurš apgleznoja Siksta kapellas griestus?; Mikelandželo; hard
Kura bija pirmā sieviete, kura saņēma Nobela prēmiju?; Marija Kirī; hard; Marija Kirī saņēma prēmiju divreiz 1903. gadā fizikā un 1911. gadā ķīmijā
Kurš uzgleznoja slaveno gleznu "Svētais vakarēdiens"?; Leonardo da Vinči; hard;
Kura senā civilizācija izgudroja riteni?; Mezopotāmija jeb Divupe; hard
Cik punktus basketbolā piešķir par bumbas triecienu grozā no augšas?; Divus; hard
Kurš ir izcīnījis visvairāk olimpisko zelta medaļu?; ASV peldētājam Maiklam Felpsam ir 28 zelta medaļas; hard
Kādas krāsas kartīte futbolā nozīmē noraidījumu?; Sarkanā; hard; 2022. gadā Francijas virslīgā kādu spēlētāju noraidīja jau spēles devītajā sekundē
Cik minūšu ilgst futbola mačs?; 90 minūtes; hard
Kāda veida sacensības ir Tour de France?; Riteņbraukšana; hard
Kurā komandā savu karjeru NBA sāka Kristaps Porzinģis?; Ņujorkas Knicks; hard
Kuru sporta veidu pārstāv Martins Dukurs?; Skeletonu; hard
Kurš ir lielākais Latvijas ezers?; Lubāns; hard
Kura ir garākā Latvijas upe?; Gauja - tās garums Latvijas teritorijā ir 452 km; hard; Daugavas kopgarums 1005 km, taču Latvijā tikai 352km
Kurš ir Latvijas nacionālais putns?; Baltā cielava; hard
Cik izpildītāju ansamblis ir kvintets?; Piecu; hard
Kā sauc vara un alvas sakausējumu?; Bronza; hard;
Cik zvaigžņu tur Brīvības pieminekļa sievietes tēls?; Trīs; easy;
Kura ir pasaulē dārgākā garšviela?; Safrāns; hard; Safrāns var maksāt pat 5-10€ par 1 gramu
Patiesi vai aplami - diennaktī ir 86400 sekundes.; Patiesi; medium
Kāds ir pēdējais burts grieķu alfabētā?; Omega - Ω, ω; hard
Cik taustiņu ir standarta klavierēm?; 88 taustiņi - 52 balti un 36 melni; hard; Imperial Bösendorfer ir īpašas lielas klavieres, tām ir 97 taustiņi
Kurš ir ātrākais sauszemes dzīvnieks?; Gepards spēj sasniegt pat 112 km/h lielu ātrumu; easy; Gepards nespēj uzkāpt kokā kā citiem kaķu dzimtas dzīvnieki.
Kādas tautības bija mākslinieks Pikaso?; Spānis; hard




















